document_id,text
1,The stock market has been experiencing volatility due to the economic uncertainty.
2,"The economy is growing, and businesses are optimistic about the future."
3,Climate change is a critical issue that needs immediate global attention.
4,Advances in artificial intelligence have revolutionized industries worldwide.
5,The rise of electric vehicles is shaping the future of the automobile industry.
6,Healthcare is evolving with the introduction of new technologies and treatments.
7,The entertainment industry is shifting towards digital streaming platforms.
8,Social media is influencing the way people interact with each other.
9,Governments around the world are investing in renewable energy projects.
10,Cybersecurity is an ongoing concern as digital platforms become more integrated.